{
  "$schema": "https://json-schema.org/draft/2020-12/schema",
  "$id": "https://tag.kaikenlabs.com/schemas/tag.template.schema.json",
  "title": "TAG Template Configuration",
  "description": "Configuration schema for TAG scaffold templates (tag.template.json)",
  "type": "object",
  "additionalProperties": false,
  "properties": {
    "name": {
      "type": "string",
      "description": "Template name for display purposes"
    },
    "description": {
      "type": "string",
      "description": "Template description"
    },
    "version": {
      "type": "string",
      "description": "Template version",
      "pattern": "^[0-9]+\\.[0-9]+\\.[0-9]+(-[a-zA-Z0-9.-]+)?(\\+[a-zA-Z0-9.-]+)?$"
    },
    "keywords": {
      "type": "array",
      "description": "Topic keywords for discoverability (all lowercase, hyphen-separated)",
      "items": {
        "type": "string"
      }
    },
    "categories": {
      "type": "array",
      "description": "High-level category buckets (e.g. backend, cli, data)",
      "items": {
        "type": "string"
      }
    },
    "vars": {
      "type": "object",
      "description": "Variable definitions",
      "additionalProperties": {
        "oneOf": [
          {
            "type": "string",
            "description": "Short form: default string value"
          },
          {
            "type": "boolean",
            "description": "Short form: default boolean value"
          },
          {
            "type": "number",
            "description": "Short form: default number value"
          },
          {
            "$ref": "#/$defs/variableDefinition"
          }
        ]
      }
    },
    "hooks": {
      "type": "object",
      "description": "Pre and post scaffold hooks",
      "additionalProperties": false,
      "properties": {
        "pre_scaffold": {
          "type": "array",
          "description": "Commands to run before scaffolding",
          "items": {
            "$ref": "#/$defs/hookEntry"
          }
        },
        "post_scaffold": {
          "type": "array",
          "description": "Commands to run after scaffolding",
          "items": {
            "$ref": "#/$defs/hookEntry"
          }
        }
      }
    },
    "test": {
      "type": "object",
      "description": "Matrix test configuration for validating boolean variable combinations",
      "additionalProperties": false,
      "properties": {
        "cases": {
          "type": "array",
          "description": "Named test cases, each with optional filters and validation commands",
          "items": {
            "type": "object",
            "required": ["name", "commands"],
            "additionalProperties": false,
            "properties": {
              "name": {
                "type": "string",
                "description": "Identifier for the test case (used with --case flag)"
              },
              "filters": {
                "type": "object",
                "description": "Boolean variable pins for this case (e.g., {\"use_docker\": true})",
                "additionalProperties": {
                  "type": "boolean"
                }
              },
              "commands": {
                "type": "array",
                "description": "Validation commands to run after scaffolding each combination",
                "items": {
                  "type": "string"
                },
                "minItems": 1
              }
            }
          },
          "minItems": 1
        },
        "project_name": {
          "type": "string",
          "description": "Project name used for scaffold output (default: test-scaffold)"
        },
        "env": {
          "type": "object",
          "description": "Environment variables passed to validation commands",
          "additionalProperties": {
            "type": "string"
          }
        }
      }
    }
  },
  "$defs": {
    "hookEntry": {
      "description": "Hook command, as a string or as an object with options",
      "oneOf": [
        {
          "type": "string"
        },
        {
          "type": "object",
          "required": ["run"],
          "additionalProperties": false,
          "properties": {
            "run": {
              "type": "string",
              "description": "Command to run"
            },
            "skip_in_test": {
              "type": "boolean",
              "description": "Skip this hook during tag test"
            }
          }
        }
      ]
    },
    "variableDefinition": {
      "type": "object",
      "description": "Long form variable definition",
      "additionalProperties": false,
      "properties": {
        "type": {
          "type": "string",
          "description": "Variable type",
          "enum": ["string", "boolean", "number", "choice"]
        },
        "prompt": {
          "type": "string",
          "description": "Prompt message for interactive input"
        },
        "default": {
          "description": "Default value for the variable"
        },
        "required": {
          "type": "boolean",
          "description": "Whether the variable is required",
          "default": false
        },
        "options": {
          "type": "array",
          "description": "Options for choice type variables",
          "items": {
            "type": "string"
          },
          "minItems": 1
        },
        "secret": {
          "type": "boolean",
          "description": "Whether to hide input (for passwords)",
          "default": false
        }
      },
      "allOf": [
        {
          "if": {
            "properties": {
              "type": {
                "const": "choice"
              }
            },
            "required": ["type"]
          },
          "then": {
            "required": ["options"]
          }
        }
      ]
    }
  }
}
